0xFE00: 0x00
0xFE01: 0x00
0xFE02: 0x00
0xFE03: 0x00
0xFE04: 0x00
0xFE05: 0x00
0xFE06: 0x00
0xFE07: 0x00
0xFE08: 0x00
0xFE09: 0x00
0xFE0A: 0x00
0xFE0B: 0x00
0xFE0C: 0x00
0xFE0D: 0x00
0xFE0E: 0x00
0xFE0F: 0x00
0xFE10: 0x00
0xFE11: 0x00
0xFE12: 0x00
0xFE13: 0x00
0xFE14: 0x00
0xFE15: 0x00
0xFE16: 0x00
0xFE17: 0x00
0xFE18: 0x00
0xFE19: 0x00
0xFE1A: 0x00
0xFE1B: 0x00
0xFE1C: 0x00
0xFE1D: 0x00
0xFE1E: 0x00
0xFE1F: 0x00
0xFE20: 0x00
0xFE21: 0x00
0xFE22: 0x00
0xFE23: 0x00
0xFE24: 0x00
0xFE25: 0x00
0xFE26: 0x00
0xFE27: 0x00
0xFE28: 0x00
0xFE29: 0x00
0xFE2A: 0x00
0xFE2B: 0x00
0xFE2C: 0x00
0xFE2D: 0x00
0xFE2E: 0x00
0xFE2F: 0x00
0xFE30: 0x00
0xFE31: 0x00
0xFE32: 0x00
0xFE33: 0x00
0xFE34: 0x00
0xFE35: 0x00
0xFE36: 0x00
0xFE37: 0x00
0xFE38: 0x00
0xFE39: 0x00
0xFE3A: 0x00
0xFE3B: 0x00
0xFE3C: 0x00
0xFE3D: 0x00
0xFE3E: 0x00
0xFE3F: 0x00
0xFE40: 0x00
0xFE41: 0x00
0xFE42: 0x00
0xFE43: 0x00
0xFE44: 0x00
0xFE45: 0x00
0xFE46: 0x00
0xFE47: 0x00
0xFE48: 0x00
0xFE49: 0x00
0xFE4A: 0x00
0xFE4B: 0x00
0xFE4C: 0x00
0xFE4D: 0x00
0xFE4E: 0x00
0xFE4F: 0x00
0xFE50: 0x00
0xFE51: 0x00
0xFE52: 0x00
0xFE53: 0x00
0xFE54: 0x00
0xFE55: 0x00
0xFE56: 0x00
0xFE57: 0x00
0xFE58: 0x00
0xFE59: 0x00
0xFE5A: 0x00
0xFE5B: 0x00
0xFE5C: 0x00
0xFE5D: 0x00
0xFE5E: 0x00
0xFE5F: 0x00
0xFE60: 0x00
0xFE61: 0x00
0xFE62: 0x00
0xFE63: 0x00
0xFE64: 0x00
0xFE65: 0x00
0xFE66: 0x00
0xFE67: 0x00
0xFE68: 0x00
0xFE69: 0x00
0xFE6A: 0x00
0xFE6B: 0x00
0xFE6C: 0x00
0xFE6D: 0x00
0xFE6E: 0x00
0xFE6F: 0x00
0xFE70: 0x00
0xFE71: 0x00
0xFE72: 0x00
0xFE73: 0x00
0xFE74: 0x00
0xFE75: 0x00
0xFE76: 0x00
0xFE77: 0x00
0xFE78: 0x00
0xFE79: 0x00
0xFE7A: 0x00
0xFE7B: 0x00
0xFE7C: 0x00
0xFE7D: 0x00
0xFE7E: 0x00
0xFE7F: 0x00
0xFE80: 0x00
0xFE81: 0x00
0xFE82: 0x00
0xFE83: 0x00
0xFE84: 0x00
0xFE85: 0x00
0xFE86: 0x00
0xFE87: 0x00
0xFE88: 0x00
0xFE89: 0x00
0xFE8A: 0x00
0xFE8B: 0x00
0xFE8C: 0x00
0xFE8D: 0x00
0xFE8E: 0x00
0xFE8F: 0x00
0xFE90: 0x00
0xFE91: 0x00
0xFE92: 0x00
0xFE93: 0x00
0xFE94: 0x00
0xFE95: 0x00
0xFE96: 0x00
0xFE97: 0x00
0xFE98: 0x00
0xFE99: 0x00
0xFE9A: 0x00
0xFE9B: 0x00
0xFE9C: 0x00
0xFE9D: 0x00
0xFE9E: 0x00
0xFE9F: 0x00
==CPU REGISTERS==
AF: 0x0010
BC: 0x0414
DE: 0x7F7F
HL: 0x9D03
PC: 0x1DA6
SP: 0xC444
Interrupt Enable: 0x0D
Interrupt Flags: 0x00
Interrupt Master: 0
