0xFE00: 0x60
0xFE01: 0x5A
0xFE02: 0x00
0xFE03: 0x00
0xFE04: 0x60
0xFE05: 0x62
0xFE06: 0x01
0xFE07: 0x00
0xFE08: 0x60
0xFE09: 0x6A
0xFE0A: 0x02
0xFE0B: 0x00
0xFE0C: 0x60
0xFE0D: 0x72
0xFE0E: 0x03
0xFE0F: 0x00
0xFE10: 0x60
0xFE11: 0x7A
0xFE12: 0x04
0xFE13: 0x00
0xFE14: 0x68
0xFE15: 0x5A
0xFE16: 0x05
0xFE17: 0x00
0xFE18: 0x68
0xFE19: 0x62
0xFE1A: 0x06
0xFE1B: 0x00
0xFE1C: 0x68
0xFE1D: 0x6A
0xFE1E: 0x07
0xFE1F: 0x00
0xFE20: 0x68
0xFE21: 0x72
0xFE22: 0x08
0xFE23: 0x00
0xFE24: 0x68
0xFE25: 0x7A
0xFE26: 0x09
0xFE27: 0x00
0xFE28: 0x74
0xFE29: 0x5A
0xFE2A: 0x0A
0xFE2B: 0x00
0xFE2C: 0x70
0xFE2D: 0x62
0xFE2E: 0x0B
0xFE2F: 0x00
0xFE30: 0x70
0xFE31: 0x6A
0xFE32: 0x0C
0xFE33: 0x00
0xFE34: 0x70
0xFE35: 0x72
0xFE36: 0x0D
0xFE37: 0x00
0xFE38: 0x70
0xFE39: 0x7A
0xFE3A: 0x0E
0xFE3B: 0x00
0xFE3C: 0x78
0xFE3D: 0x5A
0xFE3E: 0x0F
0xFE3F: 0x00
0xFE40: 0x78
0xFE41: 0x62
0xFE42: 0x10
0xFE43: 0x00
0xFE44: 0x78
0xFE45: 0x6A
0xFE46: 0x11
0xFE47: 0x00
0xFE48: 0x78
0xFE49: 0x72
0xFE4A: 0x12
0xFE4B: 0x00
0xFE4C: 0x78
0xFE4D: 0x7A
0xFE4E: 0x13
0xFE4F: 0x00
0xFE50: 0x80
0xFE51: 0x5A
0xFE52: 0x14
0xFE53: 0x00
0xFE54: 0x80
0xFE55: 0x62
0xFE56: 0x15
0xFE57: 0x00
0xFE58: 0x80
0xFE59: 0x6A
0xFE5A: 0x16
0xFE5B: 0x00
0xFE5C: 0x80
0xFE5D: 0x72
0xFE5E: 0x17
0xFE5F: 0x00
0xFE60: 0x80
0xFE61: 0x7A
0xFE62: 0x18
0xFE63: 0x00
0xFE64: 0x88
0xFE65: 0x5A
0xFE66: 0x19
0xFE67: 0x00
0xFE68: 0x88
0xFE69: 0x62
0xFE6A: 0x1A
0xFE6B: 0x00
0xFE6C: 0x88
0xFE6D: 0x6A
0xFE6E: 0x1B
0xFE6F: 0x00
0xFE70: 0x88
0xFE71: 0x72
0xFE72: 0x1C
0xFE73: 0x00
0xFE74: 0x88
0xFE75: 0x7A
0xFE76: 0x1D
0xFE77: 0x00
0xFE78: 0x90
0xFE79: 0x5A
0xFE7A: 0x1E
0xFE7B: 0x00
0xFE7C: 0x90
0xFE7D: 0x62
0xFE7E: 0x1F
0xFE7F: 0x00
0xFE80: 0x90
0xFE81: 0x6A
0xFE82: 0x20
0xFE83: 0x00
0xFE84: 0x90
0xFE85: 0x72
0xFE86: 0x21
0xFE87: 0x00
0xFE88: 0x90
0xFE89: 0x7A
0xFE8A: 0x22
0xFE8B: 0x00
0xFE8C: 0x00
0xFE8D: 0x00
0xFE8E: 0x00
0xFE8F: 0x00
0xFE90: 0x00
0xFE91: 0x00
0xFE92: 0x00
0xFE93: 0x00
0xFE94: 0x00
0xFE95: 0x00
0xFE96: 0x00
0xFE97: 0x00
0xFE98: 0x00
0xFE99: 0x00
0xFE9A: 0x00
0xFE9B: 0x00
0xFE9C: 0x00
0xFE9D: 0x00
0xFE9E: 0x00
0xFE9F: 0x00
==CPU REGISTERS==
AF: 0x0000
BC: 0x06C5
DE: 0x1E17
HL: 0x9989
PC: 0x1DB6
SP: 0xC49A
Interrupt Enable: 0x0D
Interrupt Flags: 0x00
Interrupt Master: 0
